{
  "verdict_id": "7922315b-a6c9-5157-b067-0934635e11d1",
  "claim_id": "c4188956-255a-5805-ab05-5a0759fd9719",
  "status": "supported",
  "confidence": {
    "source_authority": 1.0,
    "directness": 1.0,
    "temporal_alignment": 1.0,
    "entity_resolution": 1.0,
    "cross_source_consistency": 0.9,
    "overall": 0.98
  },
  "summary": "Tier-1 Knesset OData record confirms PersonID=134 has IsCurrent=true; the claim is supported by the archived KNS_Person row.",
  "needs_human_review": false,
  "model_version": "rules-v0.1",
  "ruleset_version": "r0.1",
  "created_at": "2026-04-23T17:37:43Z"
}
